Caption ID,Caption Family,Recommended Segment,Poster Variant,Spintax Caption,Plain Caption,CTA Link Placeholder,Notes
CAP-A,Founder Feedback / Private Camp Space,State/regional deer groups,FB-Core-DeerCamp,"{Hey|Hi} {deer camp folks|fellow hunters} - I’m Eric, founder of DeerCamp. I’m building a private, invite-only place for hunting camps to keep {photos|pictures}, stories, rules, recipes, updates, and field memories together. It’s free to build a camp. I’d appreciate feedback from people who actually live this stuff every season: {LINK}","Hi deer camp folks - I’m Eric, founder of DeerCamp. I’m building a private, invite-only place for hunting camps to keep photos, stories, rules, recipes, updates, and field memories together. It’s free to build a camp. I’d appreciate feedback from people who actually live this stuff every season: {LINK}",{STATE_OR_SEGMENT_LINK},Best first-wave caption. Soft founder feedback tone.
CAP-B,Camp Legacy / Stories,"Whitetail culture, big buck, camp history",FB-Legacy-Stories,"{Question for the group|Curious what you all think}: every deer camp has photos, rules, recipes, inside jokes, and stories that never make it past the cabin table. I’m building DeerCamp so camps can preserve that privately with their own members. {Would value feedback|Would appreciate your thoughts}: {LINK}","Question for the group: every deer camp has photos, rules, recipes, inside jokes, and stories that never make it past the cabin table. I’m building DeerCamp so camps can preserve that privately with their own members. Would value feedback: {LINK}",{STATE_OR_SEGMENT_LINK},Good for culture/community groups and second post angle.
CAP-C,Field Memory / Public Land,"Public land, scouting, field-memory groups",FB-Field-Memories,"{For public land hunters|For anyone who hunts away from camp}: I’m testing DeerCamp’s field memory idea - quick photos, notes, and voice memories that can be shared back to your private camp feed. Built for scouting, sits, recoveries, and the stories you want to remember later. Feedback welcome: {LINK}","For public land hunters: I’m testing DeerCamp’s field memory idea - quick photos, notes, and voice memories that can be shared back to your private camp feed. Built for scouting, sits, recoveries, and the stories you want to remember later. Feedback welcome: {LINK}",{STATE_OR_SEGMENT_LINK},Use for public land and field-oriented groups.
CAP-D,Shed / Antler,Shed/antler groups,FB-Shed-Antler,"Shed season creates some of the best off-season camp memories. I’m building DeerCamp as a private place for camps to save finds, photos, stories, maps, and year-round updates. Not selling anything here - just looking for feedback from hunters: {LINK}","Shed season creates some of the best off-season camp memories. I’m building DeerCamp as a private place for camps to save finds, photos, stories, maps, and year-round updates. Not selling anything here - just looking for feedback from hunters: {LINK}",{STATE_OR_SEGMENT_LINK},Use only later for antler/shed segments.
CAP-E,Recovery / Tracking,Dog tracking/recovery groups,FB-Recovery-Stories,"Recovery stories are part of camp history too. I’m building DeerCamp to help private camps keep photos, field notes, voice memories, and stories in one invite-only place. Would appreciate feedback from hunters and trackers: {LINK}","Recovery stories are part of camp history too. I’m building DeerCamp to help private camps keep photos, field notes, voice memories, and stories in one invite-only place. Would appreciate feedback from hunters and trackers: {LINK}",{STATE_OR_SEGMENT_LINK},Use only with tracking/dog groups after first wave.
